index,id,created_at,text,author.id,author.created_at,author.username,author.location,author.public_metrics.followers_count,geo.full_name,public_metrics.like_count,public_metrics.retweet_count,sentiment
625,1084849023746494464,2019-01-14 16:25:37+00:00,"HALF PRICE! All our fresh &amp; homemade dishes are 50% off on Best Friend Tuesdays. Try a tasty Jacobs ladder beef rib or our awesome chickpea &amp; quinoa vegan burger. Book in now, we are open… https://t.co/85wOaRKmxu",24020797,2009-03-12T19:59:51.000Z,TheStagNW3,"67 Fleet Rd, London, NW3 2QU",2544,"Camden Town, London",0,1,0.9336
627,1084847844455010305,2019-01-14 16:20:56+00:00,@GMB @GuyVerhoftwat All vegan food should have 'you're a dick' label on it.,594990243,2012-05-30T21:05:36.000Z,wayne_jolly,"England, United Kingdom",425,"London, England",0,0,-0.5106
628,1084841923439968256,2019-01-14 15:57:24+00:00,Just in case 🧳 it comes in vegan leather \n.\nYou know when you are in Shoreditch when a new luggage brand comes in vegan leather and has a built in power bank for instant device charging… https://t.co/k0IaXw7Lbv,22045240,2009-02-26T18:54:24.000Z,wuthecleaner,London,268,"Hackney, London",0,0,0.0
629,1084841679318892544,2019-01-14 15:56:26+00:00,"Five a day, check!🌿🥦🍵#freshproduce #eatthatbroccoli\n.\n.\n #food #foodlover #foodphotography #photography #foodstyling #blogger #foodstylist #foodblogger #love #tbt  #vegan… https://t.co/hXjjTu5wHG",838299187045351425,2017-03-05T08:04:35.000Z,thecookbooklife,"London, England",49,"London, England",1,0,0.0
630,1084840319177371648,2019-01-14 15:51:02+00:00,Why not all wines are vegan or vegetarian? Find out it here \n👉🏻 https://t.co/DlODreUPCt\n#winelovers #veganwine #venuswinespirit,983981537258549248,2018-04-11T08:14:14.000Z,Venus_plc,"London, England",1629,"London, England",0,0,0.0
632,1084836676764094464,2019-01-14 15:36:33+00:00,You have reached peak vegan https://t.co/Vv9YyLRLD9,800326376507117568,2016-11-20T13:14:12.000Z,F_F_Flora,"Bristol, England",7822,"Camden Town, London",8,0,0.1027
633,1084819056090382336,2019-01-14 14:26:32+00:00,Went to @shoryuramen on an #invite to try their January ‘detox’ menu - this is the spicy vegan miso ramen with tofu and tenderstem broccoli. We had all three sides on on offer of sesame… https://t.co/70ZfXdXGge,15915621,2008-08-20T09:15:08.000Z,hollowlegs,Berlin,21888,"London, England",2,0,0.0
634,1084813865647591425,2019-01-14 14:05:55+00:00,"2-4-1 on all Vegan and Veggie mains! \n\nWe recommend you try our super tasty January special 'Born to Live' Burger. \n\nA beyond meat patty, vegan chipotle slaw, vegan gouda cheese, roasted red peppers, lettuce and pickles encased in a beetroot brioche bun. \n\nWhat's not to love?",2644205589,2014-06-26T15:43:40.000Z,BrewDogSoho,"21 Poland Street, Soho, London",1703,"London, England",0,0,0.8452
635,1084803226229194752,2019-01-14 13:23:38+00:00,Monday blues? Well come on down and be good to your self with our new Vegan and Vegetarian menu and enjoy our 50% off all food!\n\n#Veguary #food #discounts #london #bars https://t.co/NFS0qUle9y,539084003,2012-03-28T14:20:24.000Z,RevsAmericaSq,"Tower Hill, London",225,"London, England",0,0,0.8172
636,1084793329076834304,2019-01-14 12:44:18+00:00,"Marks and Spencer new vegan range (Plant Kichen) is really nice as expected. The coleslaw is out of boundssss, so good. Well done @marksandspencer, keep pushing 🙌",54640937,2009-07-07T18:55:54.000Z,meleshamufc,,1113,"City of London, London",0,0,0.8486
638,1084785753064988672,2019-01-14 12:14:12+00:00,More #vegetarian and #vegan inspiration here! https://t.co/UUYjk7wIUL,1058291880641880064,2018-11-02T09:37:01.000Z,HealthiliciousM,"Lewisham, London",176,"London, England",0,1,0.5707
639,1084774727439261697,2019-01-14 11:30:23+00:00,"...vegan Grande Bouffe SOLD OUT ao we’ve added a 2nd night, visit website and book now for Weds 30th Jan 🌽 https://t.co/ZtoaW5QXev",4767068613,2016-01-10T19:32:23.000Z,sardinelondon,"Parasol Unit, N1",1546,Sardine,3,0,0.0
640,1084773735566057473,2019-01-14 11:26:27+00:00,I’m so disappointed that London seems to have completely sold out of vegan sausage rolls @GreggsOfficial ...but this also makes me really happy! Vegans are showing their power! 🌱 #vegansausageroll #greggs,249285088,2011-02-08T18:53:25.000Z,DavidAllwood_,London,1885,"Lambeth, London",6,0,0.2924
641,1084766677798174720,2019-01-14 10:58:24+00:00,"Basil &amp; Tofu Ravioli!  Bought in France 🇫🇷 with Waitrose creamy vegan 🌱 sauce, with garlic and mushrooms and grated vegan 🌱 cheese yummy 😋 #vegan #govegan… https://t.co/rfk3tUB34A",42958646,2009-05-27T20:07:13.000Z,bongop,"London, England",297,"London, England",1,0,0.5707
642,1084761545572261888,2019-01-14 10:38:01+00:00,Love this set of pictures by vegan_at_tiffs showing are popular Faluda and Sri Lankan lamprais 😍\nRepost:\n.\n.\nDry January = Treating ourselves to exquisite drinks at @pamban_cafe Chai &amp;… https://t.co/EYlIFjdFk5,740541165146083328,2016-06-08T13:49:07.000Z,pamban_cafe,"London, England",295,"London, England",1,0,0.7906
643,1084759274994257920,2019-01-14 10:28:59+00:00,Spaces left for the pub quiz tonight! Still 2 for 1 on all food with a donation to our food bank collection! \n\n#vegan #vegans #vegansofig #vegansofinstagram #plantbased #plantbaseddiet… https://t.co/MtLkX6etvu,318525063,2011-06-16T16:37:37.000Z,TB_and_TT,"London, EC1V 4PA",789,"Islington, London",0,0,0.0
644,1084757183374544897,2019-01-14 10:20:40+00:00,Sicilian Blood Orange sorbet - tantalyzing close-up! Right in season and so refreshing. Lick through it 🤤#vegan #delicious #gelato #dessertporn #gelateria #icecream #sweettooth #cakeporn… https://t.co/RMvfqM4FAi,295825248,2011-05-09T18:37:02.000Z,LaGelatiera,LONDON ,2647,"London, England",1,2,0.0
645,1084736905592348674,2019-01-14 09:00:06+00:00,@mylkpluss @holland_barrett Delicious #vegan milk now in stock in  Victoria Street store ☺️ https://t.co/ujK9VUQ02v,297990162,2011-05-13T13:36:17.000Z,PepiBom,,29,"London, England",4,3,0.5719
646,1084733116869238784,2019-01-14 08:45:03+00:00,JERK MONDAY! Half Price Half Jerk Chicken. Also Half Price Jah Love Vegan Platter tonight in Dalston @ Rudie's https://t.co/2NlFe7v7sn,2921528045,2014-12-14T15:40:03.000Z,RudiesLondon,Stoke Newington Rd & Boxpark S,4153,"Hackney, London",1,0,-0.1593
647,1084732511048138753,2019-01-14 08:42:38+00:00,"Some more new products to celebrate #Veganuary  \nVegan chia pots with dates, pear &amp; pomegranate as well as new vegan &amp; dairy free carrot cake Bircher muesli pots @VacherinLondon https://t.co/xW0Ta7UihX",833964911491440640,2017-02-21T09:01:44.000Z,Emma_Abruzzese,"London, England",145,"City of London, London",6,0,0.8442
649,1084732089461747712,2019-01-14 08:40:58+00:00,@tresdessert I had the Gregg’s vegan sausage roll yesterday and it was 👌👌,311397992,2011-06-05T11:29:46.000Z,gabykirschner,NYC,8022,"London, England",1,0,0.0
650,1084707224285560832,2019-01-14 07:02:09+00:00,Chris is just another middle class snob  embracing veganism  #gmb,23431857,2009-03-09T13:02:37.000Z,PERSIMONE,"England, United Kingdom",194,"Camberwell, London",0,0,-0.4588
652,1084581885064421376,2019-01-13 22:44:06+00:00,@KermodeMovie @GenMerchBelfast I should also point out important l’y that #guinness is #vegan too @Aly_Dodge,19509044,2009-01-25T22:47:29.000Z,vetnurselise,Londinium,359,"Lambeth, London",1,0,0.2023
653,1084568868109107201,2019-01-13 21:52:23+00:00,"""vegan avocado @ Jubilee street E1"" in #London #UnitedKingdom https://t.co/6ziYLqlxHg #foodwaste #free",824637752574488576,2017-01-26T15:18:56.000Z,WhatsOnOLIO,,1091,"Poplar, London",0,0,0.0
654,1084566176091553800,2019-01-13 21:41:41+00:00,@krishalpin @BootstrapCook Next time you're in Camden let me take you to @rudysDVD &amp; try their vegan mozzarella sticks. OMG. Sooooo yummy. Not dieting in any way but life's too short to miss out RDVD.,1487224332,2013-06-06T08:41:10.000Z,MikScarlet,"Camden, London",13797,"Camden Town, London",2,0,0.0772
655,1084563009819807744,2019-01-13 21:29:06+00:00,"""kofu steak vegan@ Jubilee street E1"" in #London #UnitedKingdom https://t.co/ObhPV1jdd1 #foodwaste #free",824637752574488576,2017-01-26T15:18:56.000Z,WhatsOnOLIO,,1091,"Poplar, London",0,0,0.0
656,1084561207288315905,2019-01-13 21:21:56+00:00,GF Southern Fried Vegan Bites 🌱 https://t.co/uyEBq4wMtk,1074394357200027653,2018-12-16T20:02:30.000Z,CoupleaVeganz,London/Kent,45,"London, England",2,0,0.0
657,1084557255327039488,2019-01-13 21:06:14+00:00,"""UPDATED  Sushi (Vegan or Fish)"" in #London #UnitedKingdom https://t.co/D2zlxNlizd #foodwaste #free",824637752574488576,2017-01-26T15:18:56.000Z,WhatsOnOLIO,,1091,"Paddington, London",0,0,0.0
659,1084555832212291585,2019-01-13 21:00:35+00:00,@bigfatsurprise Imagine how it is for us pitching at this hostile environment for @ethical_butcher . There’s too much money to be made in churning out unhealthy plant based GMO food by big VCs. They’ve tapped into the vegan population and are spending huge sums promoting the vegan lifestyle.,943146855340347392,2017-12-19T15:51:47.000Z,ethical_butcher,"London, England",3727,"Kensington, London",0,0,-0.3818
661,1084554888527388672,2019-01-13 20:56:50+00:00,@JoannaBlythman @mistereatgalway Imagine how it is for us pitching at this hostile environment for @ethical_butcher . There’s too much money to be made in churning out unhealthy plant based GMO food by big VCs. They’ve tapped into the vegan population and are spending huge sums promoting the vegan lifestyle.,943146855340347392,2017-12-19T15:51:47.000Z,ethical_butcher,"London, England",3727,"Kensington, London",5,0,-0.3818
662,1084553791473704961,2019-01-13 20:52:28+00:00,"""UPDATED Raw, Vegan Pronuts (like protein balls,..."" in #London #UnitedKingdom https://t.co/W01ZLSsG1q #foodwaste #free",824637752574488576,2017-01-26T15:18:56.000Z,WhatsOnOLIO,,1091,"Paddington, London",0,0,0.0
663,1084550382326550531,2019-01-13 20:38:55+00:00,"""Wholesome Organic Bread (GF, WF, Vegan options!)"" in #London #UnitedKingdom https://t.co/dnrR2ru1tl #foodwaste #free",824637752574488576,2017-01-26T15:18:56.000Z,WhatsOnOLIO,,1091,"Paddington, London",0,0,0.0
664,1084535488264978433,2019-01-13 19:39:44+00:00,"⚠️Ready 4 Monday💪 #gains #progress #muscle #musclebuilding #fitness #fit #fitfam #gym #gymgang #vegan #veganbodybuilding #gainz #legpress #gymmusic #fitnessmusic #glorytogod 🙏🏾 @ London,… https://t.co/7fH8Kpaz47",784034464225759236,2016-10-06T14:15:57.000Z,Armourhotwater,United Kingdom,592,"London, England",4,0,0.0
666,1084531547510849536,2019-01-13 19:24:05+00:00,🍃 Stunning inspo with our majestic #wild mountain #mint! 🍃\n\nhttps://t.co/m5RynsWdUh\n\n#detox #veganuary #dryjanuary #wellbeing #art #sustainable #wellness #healthy #health #healthylifestyle #luxury #lifestyle #chef #foodie #tea #glutenfree #herbal #vegan #vegetarian #london https://t.co/rHeR6D6q9i,791408393961570304,2016-10-26T22:37:19.000Z,NazaniTea,"London, England",934,"Kensington, London",4,0,0.4389
667,1084529451914932225,2019-01-13 19:15:45+00:00,#Veganuary day 13 - a vegan chilli in the oven and a table full of oatmeal nutty chocolate cookies... should really have countryfile on when I’m being this much of an adult,222570700,2010-12-03T20:15:40.000Z,ArranByers,"London, England",142,"Islington, London",2,0,0.0
668,1084528966617116672,2019-01-13 19:13:49+00:00,"#Beetroot dish, and no, not vegan😁 @ Bistrotheque https://t.co/keDPadVEyW",28561363,2009-04-03T13:26:10.000Z,wobblyclark,"London, England",1675,"Poplar, London",0,0,-0.296
669,1084521960380526592,2019-01-13 18:45:59+00:00,And the best for last #vegan cake from @ferrero_ta #veganuary from #taranto to #london @ Camden Town https://t.co/Mwwzsk7S0f,7065292,2007-06-25T08:54:07.000Z,magomarcelo,London,703,"Camden Town, London",0,0,0.6369
670,1084517268384567297,2019-01-13 18:27:20+00:00,does anyone have any vegetarian/vegan recommendations in london besides bychloe ??,754149618,2012-08-13T01:29:33.000Z,tolerateseason,22,1290,"London, England",6,0,0.0
671,1084509656922443778,2019-01-13 17:57:06+00:00,"I don’t understand when Sex Education (on Netflix) is meant to be set. They talk about the internet and veganism, but everything else seems so early 90s.",810017635,2012-09-08T02:26:00.000Z,harry_chitty,"Colchester, England",1337,"Camberwell, London",0,0,0.0
672,1084505523389632513,2019-01-13 17:40:40+00:00,"A shortage of vegan chefs in London you say? 🤔 Not in 3 months time, when me and my 7 fellow classmates finish up at theveganchefinstitute 🙌 So yeah, here's part of the 2019 change I've… https://t.co/3ZCN5vpaWS",3324784323,2015-06-14T13:26:34.000Z,JenCooksPlants,"London, England",345,"Wandsworth, London",0,0,0.1263
673,1084496341403865089,2019-01-13 17:04:11+00:00,Even more #vegan #veganuary @ Camden Town https://t.co/NN3HfhWjFY,7065292,2007-06-25T08:54:07.000Z,magomarcelo,London,703,"Camden Town, London",0,0,0.0
674,1084492106855604224,2019-01-13 16:47:21+00:00,"End ya week on a high with one of our salad boxes packed to the brim with chick’n, risotto balls, mixed salad, seeds, vegan mayo &amp; chutney 🤤 🥗 🇦🇺 @ Arancini Brothers https://t.co/9fDL4zpk7i",84396832,2009-10-22T19:03:16.000Z,AranciniBros,"London, United Kingdom",2062,"Hackney, London",0,0,0.0
675,1084487124420907008,2019-01-13 16:27:33+00:00,"As someone who has a nut allergy, I  have to say I personally find the rise of vegan cafes, e.g. a coffeeshop with baked goods, as some new alternative to be frustrating. There are almost zero options for vegan baked goods that don’t have nuts in them.",262444535,2011-03-08T02:02:53.000Z,afrosypaella,Atlanta + The World,17389,"Camden Town, London",9,0,-0.6369
676,1084484154077663232,2019-01-13 16:15:45+00:00,Really great to see @notplantbased on the cover of this week’s @YOUMagSocial! I loved interviewing them a couple of years ago for @Quench_Food  🍽📝 https://t.co/KPd94o5gKv,613354139,2012-06-20T11:18:18.000Z,eleanor__p,London,3043,"Camberwell, London",2,0,0.862
677,1084479590934999040,2019-01-13 15:57:37+00:00,"When you get takeout from @honestburgers but get home to discover they thought you meant onion rings INSTEAD of chips when you definitely said “as well”. 😩 \nOn the upside, I’m stuffed anyway and this month’s vegan special is delish.👌🏻 #Veganuary",21997692,2009-02-26T10:51:50.000Z,sarahvsshark,Pembrokeshire,2656,"Camberwell, London",3,0,0.7964
678,1084472144803708930,2019-01-13 15:28:02+00:00,#vegan #bruschetta with #romanian #zacusca #aubergine #mushroom and #gintonic #oldtom @ Camden Town https://t.co/UKDll1FY8D,7065292,2007-06-25T08:54:07.000Z,magomarcelo,London,703,"Camden Town, London",0,0,0.0
679,1084465113518747648,2019-01-13 15:00:06+00:00,"I’ve been taking 2 of these heart shaped @kittyrebelofficial chewable hair vitamins for healthier &amp; longer hair. They are also vegan, gluten free, soya free and cruelty free 🌱 \nUse code: ROLLINFUNKY15 at the checkout for 15% off 😃 Ad\n\n#kittyrebel #hairvitamins #rollinfunky https://t.co/pDDpeHfmt0",297975511,2011-05-13T13:04:22.000Z,RollinFunky,"Notting Hill, London, UK",784,"London, England",1,0,0.7184
680,1084455506947833856,2019-01-13 14:21:55+00:00,"After shopping, I need food! Like a rainbow right? Love it! \n#vegan #veganlunch #sweetpotatoe #beans #hummous #keepitup #wine #takeiteasy #shopping #salad #tofu #healthy #fitness… https://t.co/byumeXeEXJ",2431777939,2014-04-07T09:21:57.000Z,NadiaThemis,"London, United Kingdom ",1607,"London, England",1,0,0.8065
682,1084448004302688256,2019-01-13 13:52:06+00:00,@samatlounge I got fired from my second sandwich shop job for trying to persuade Thom Yorke to add bacon and/or Parmesan to his hummus and avocado baguette (and also repeatedly stealing corners off brownies). I was a 17-year-old vegan shamer - wotadick.,1245735997,2013-03-06T09:56:39.000Z,annajeanhugs,London,1447,"City of London, London",1,0,-0.8074
683,1084442362863017984,2019-01-13 13:29:41+00:00,Greggs: How its vegan sausage roll stormed social media https://t.co/E8kSQtjIkN https://t.co/DBNRGGN7Pz,284988324,2011-04-20T10:07:38.000Z,LeonFDelCanto,"Strand, London",6399,"London, England",0,0,0.0
684,1084437113293164549,2019-01-13 13:08:50+00:00,A few people have suggested @TheospizzaLDN for our top ten restaurants in Kennington. We haven't been yet - do they have any vegan options? @ Theo's https://t.co/ojaBt465Jk,1514547872,2013-06-13T21:44:14.000Z,KenningtonRUN,"Kennington, London",1842,"Camberwell, London",0,0,0.2023
685,1084436946968080385,2019-01-13 13:08:10+00:00,Me sprinkling cheese on top of a perfectly vegan plant based dish 🧀🧀 https://t.co/5QrIsugYme,482217735,2012-02-03T17:16:10.000Z,Lauren9Dudley,"London, UK",8561,"Lambeth, London",13,0,0.7184
686,1084433492245729282,2019-01-13 12:54:27+00:00,Thank you @SundayBrunchC4 for listening to your audience and putting more cruelty free recipes on the show. Awesome to see @pritchardswyd working his vegan magic for the masses. #sundaybrunch #vegan,61841131,2009-07-31T18:35:57.000Z,buddhaboy74,,3680,"Lambeth, London",8,0,0.7171
688,1084428410057822211,2019-01-13 12:34:15+00:00,"@dino_tommasi @Rubywax @SundayBrunch My thoughts exactly!\nPromoting a book about human kindness, yet no respect for animals. \nYou couldn't make up the hypocrisy!\n#rubywax #SundayBrunch #vegan",61841131,2009-07-31T18:35:57.000Z,buddhaboy74,,3680,"Lambeth, London",4,2,0.6688
690,1084426837307080706,2019-01-13 12:28:00+00:00,"@SindyGreenhouse She's obsessed with saying vegan jibes at every possible turn.\nIt's almost like a reflection of her darkness and lack of compassion. \nShe's on the show promoting how humans need to interact, yet no thought about what she puts in her mouth (or what comes out of it)! #SundayBrunch",61841131,2009-07-31T18:35:57.000Z,buddhaboy74,,3680,"Lambeth, London",3,0,0.202
691,1084425668337827845,2019-01-13 12:23:21+00:00,Scrambled ackee for breakfast wulfandlamb yumyum\n.\n.\n.\n.\n.\n#vegan #vegansofig #whatveganseat #veganlondon #londonvegan #vegansoflondon #vegansofldn #veganinlondon #plantbaseddiet… https://t.co/hvzKjY2hPv,4242760899,2015-11-21T14:56:04.000Z,nowiseeclearer,"London, England",25,"Kensington, London",2,0,0.0
692,1084423583277957121,2019-01-13 12:15:04+00:00,"Ladies &amp; gentlemen, January vibes. Younger than Botox. Olive oil saves visage. #vegan #beauty #yoga https://t.co/oUqmIe3Jgz",934892821,2012-11-08T16:30:51.000Z,St_SugarLondon,"London, England",2150,Brick Lane and Market,0,0,0.0
693,1084422724334833666,2019-01-13 12:11:39+00:00,Vegan chilli for lunch.\n\nSimple add a couple of vegetables of your choice. I had a courgette and aubergine plus some onion.\n\nLightly fry until softened and then add two cans of kidney… https://t.co/f8Bk4MRdVr,86132960,2009-10-29T18:39:55.000Z,neildamerell,"London, England",251,"London, England",1,0,0.0
694,1084415274537967616,2019-01-13 11:42:03+00:00,🙆🙆🙆 Believe achieve succeed! 🙆🙆🙆\n-\n-\n-\n#vegan #selfie #ootd #makeup #darkgrey #hair #gains #workout #gym #arms #fitness #body #face #brows #eyes #lips #travel #hoddie #fashion #style… https://t.co/ryUQt0cytv,461986405,2012-01-12T12:39:48.000Z,BOBBYSVEGAN,UK,926,"London, England",4,0,0.5411
696,1084415000851238913,2019-01-13 11:40:58+00:00,@piersmorgan @MailOnline Are you man enough to try vegan for 40 day and 40 nights?! I challenge you! Do it to prove to everyone it’s not good for us! Make a documentary about it... I bet millions will watch!!,468203313,2012-01-19T08:47:06.000Z,JayPUreta,Everywhere Anywhere Here there,95,"Lambeth, London",0,0,-0.5063
697,1084409976712454144,2019-01-13 11:21:00+00:00,"I must admit I have been a little disappointed with the Vegan selection of take away good, very bored of having the same veg sandwich from Sainsbury’s/marks/pret. Yesterday’s visit to… https://t.co/cifuarAk1P",22938505,2009-03-05T16:21:17.000Z,abbisimms,"London, England",685,"Camberwell, London",0,0,-0.128
698,1084397185318305793,2019-01-13 10:30:10+00:00,"Roasted Tomato, Bean &amp; Quinoa Soup with a drizzle of tahini and a sprinkle of pumpkin seeds 😍 Whether you’e taking part in #Veganuary or you just enjoy a delicious plant-based meal, check… https://t.co/WD0JRByiBy",221859510,2010-12-01T20:27:45.000Z,elibrecher,London,214,"London, England",0,0,0.7845
699,1084393047272710144,2019-01-13 10:13:44+00:00,Something must be done with our bodies in January. At least for show. We cannot go on like this. The pressure of social media is on. #streetart #vegan #tour https://t.co/XSdeH9sVm8,934892821,2012-11-08T16:30:51.000Z,St_SugarLondon,"London, England",2150,Brick Lane and Market,1,2,-0.5122
700,1084382132217225216,2019-01-13 09:30:21+00:00,When it looks like you're in a studio but you're literally just in the street 🤷‍♀️\n.\n.\n.\n.\n.\n.\n.\n.\n.\n.\n.\n.\n.\n#editorial #vegan #vegangirl #model #modellife #ootd #blogger #fitfam #fit… https://t.co/Likj3GDAAu,2886985221,2014-11-21T16:03:55.000Z,laurensaliu,"London, England",134,"Hackney, London",0,0,0.1901
701,1084259536393945088,2019-01-13 01:23:12+00:00,10 Best #Vegan Protein Powders That Aren't Full of Sugar (and Taste Great)\n https://t.co/PtPAaSQF8c,786609585083723779,2016-10-13T16:48:34.000Z,MagicVillageLDN,"Primrose Hill, London",507,"Camden Town, London",0,0,0.6369
702,1084232148369002497,2019-01-12 23:34:22+00:00,The questions everyone's asking #Google about #veganism\nhttps://t.co/Ihbx3lEk6P,1057021355076534272,2018-10-29T21:28:24.000Z,VanaspatiHerbs,"London, England",146,"London, England",0,0,0.0
703,1084218218800205827,2019-01-12 22:39:01+00:00,"""vegan calzone"" in #London #UnitedKingdom https://t.co/w2x5PZdzXp #foodwaste #free",824637752574488576,2017-01-26T15:18:56.000Z,WhatsOnOLIO,,1091,"Poplar, London",0,0,0.0
704,1084217981926813697,2019-01-12 22:38:05+00:00,"""tanpopi vegan bowl"" in #London #UnitedKingdom https://t.co/TdsDbcnbTT #foodwaste #free",824637752574488576,2017-01-26T15:18:56.000Z,WhatsOnOLIO,,1091,"Poplar, London",0,0,0.0
705,1084193074266427392,2019-01-12 20:59:06+00:00,"First try of @marksandspencer Vegan Kitchen range tonight - Pretty decent Chilli non Carne, so flavoursome... And that’s from a non-#Vegan 😂 #heathychoices #meatfree #plantbased",355012768,2011-08-14T17:44:52.000Z,Findlay_Hr,Here,140,"London, England",1,0,0.4939
706,1084181975324393472,2019-01-12 20:15:00+00:00,DO YOU KNOW WHAT ARE PLANT BASED? CHIPS. SO LET’S ALL EAT CHIPS.,16970321,2008-10-25T19:18:56.000Z,marcooth,"London, England",1678,"Camberwell, London",7,0,0.0
707,1084162953874677763,2019-01-12 18:59:25+00:00,Welcome to homemade Smoky vegan Baba Ghanouch topped with (Kufta) a fresh lamb mince mixed with light spices &amp; fresh parsley grilled with olive oil.\nEnjoy your Royal meal.👏😋\n-\n#babaghanoush #smoky #healthyfoods #lunch #dinner #kufta #kuftah #catering #London #Aleppo #sotasty https://t.co/ptfw4hwbXI,828029973449605120,2017-02-04T23:58:24.000Z,alepposupper,"England, United Kingdom",279,"London, England",3,0,0.765
708,1084162700521951232,2019-01-12 18:58:25+00:00,We've been getting lots of press ahead of our curry house launch which is mega exciting. We're eternlly grateful for the support - thank you @eveningstandard @absolutely_mag @business @countryandtown\n\n #Veganuary #Vegan #London #Walthamstow #LondonBoroughOfCulture https://t.co/4HIgAzOFHG,3795910694,2015-10-05T20:48:21.000Z,eatspicebox,"London, England",1567,"London, England",2,0,0.886
709,1084151808757559296,2019-01-12 18:15:08+00:00,"1, 2, 3 or 4 what would you order? 🍟🍲 It’s Veganuary a perfect excuse to go check out a Vegan cafe/restaurant. Therefore, I visited @eatgenesis to try out their delicious vegan food and… https://t.co/YajWDYJEnO",1564062120,2013-07-02T20:50:40.000Z,Adil_Musa1,"London, England",3910,"Poplar, London",0,0,0.8271
710,1084149354015928321,2019-01-12 18:05:23+00:00,Struggling with Veganuary? Not quite sure what to cook? We’ve still got tables available tomorrow and our Vegan roast is BANGING. \nhttps://t.co/tWDY8pfvbW for bookings.\n.\n.\n.\n.\n.\n#vegan… https://t.co/dIfj39p13l,329922777,2011-07-05T20:39:46.000Z,MontpelierPub,"Choumert Road, Peckham Rye",5445,"Camberwell, London",0,1,-0.6529
711,1084140862488096768,2019-01-12 17:31:38+00:00,"Cherry tomatoes, blood orange and mezcal dressing #healthy #fresh #vegan #veganuary #food #foodie #instafood #igfood #gazelle @ London, United Kingdom https://t.co/N2NKkvrPOn",24236661,2009-03-13T19:41:46.000Z,radiodrsarah,London,640,"London, England",2,0,0.4215
713,1084129929476931584,2019-01-12 16:48:12+00:00,@Animals_feel2 @ChrisGPackham @frogprincess8 I wish more people would present a rounded picture. Veganism and/or blaming farming on on trend currently. There are more productive and constructive ways of winning against climate breakdown.,20613575,2009-02-11T19:11:59.000Z,Tom_Clarke,North London & The Fens,5860,"Islington, London",1,0,0.4404
714,1084129471316324354,2019-01-12 16:46:22+00:00,It’s a pizza sort of weekend. The pizza found at abqlondon is among the best vegan pizzas in the world. It’s so nice to share with good company. London really does pizza so well. To… https://t.co/Y6LOU1qbXL,14585497,2008-04-29T14:46:12.000Z,seandburke,"Seattle, WA",4950,"Poplar, London",0,0,0.9425
715,1084122693212012544,2019-01-12 16:19:26+00:00,"#Repost @amyrayyyyy with get_repost\n・・・\nI thought people were lying when they hyped this place up but jeeeez. Vegan Brazilian food, crazy good 🔥 took a piece of the passion fruit… https://t.co/EHN5jXjqqk",569841191,2012-05-03T09:48:53.000Z,EssentialVegan,"Dalston, England",2769,"Hackney, London",1,0,0.5499
717,1084113655069847552,2019-01-12 15:43:31+00:00,@GSPN90MINS lol I m a pure vegan,1213737680,2013-02-23T21:25:14.000Z,betty_nwabunike,United Kingdom,122763,"London, England",1,0,0.4215
