index,id,created_at,text,author.id,author.created_at,author.username,author.location,author.public_metrics.followers_count,geo.full_name,public_metrics.like_count,public_metrics.retweet_count,sentiment
1286,1080865876314939394,2019-01-03 16:38:01+00:00,@MegaSlippers any good? \nhow does it pair up to the standard meaty boy?\ndid you have a vegan one and a standard one so you could get a good comparison? :P,425903951,2011-12-01T15:49:04.000Z,RobArlow75,Watford,113,"City of London, London",0,0,0.8581
1288,1080864854481793030,2019-01-03 16:33:57+00:00,@Sara_Rose_G Vegan papoose.,100675178,2009-12-31T04:06:42.000Z,worgztheowl,London,1932,"Lambeth, London",1,0,0.0
1289,1080862520569675776,2019-01-03 16:24:41+00:00,Neglected to mention my favourite vegan pastry earlier which is @holland_barrett’s #SteaklessBake as it has gravy 🤗 P.S. they also do vegan sausage rolls and have done for a very long time,227290857,2010-12-16T12:56:01.000Z,DebsFurness,Oxfordshire,648,"Paddington, London",2,0,-0.5267
1291,1080861672271679490,2019-01-03 16:21:18+00:00,London beginning to replicate SF &amp; LA. Shameful.\nImagine if this angered people as much as a vegan sausage roll. https://t.co/Akha77LVuj,250599782,2011-02-11T12:21:54.000Z,willjennings80,london,8499,"Camberwell, London",24,6,-0.596
1292,1080861057701367818,2019-01-03 16:18:52+00:00,"Despite being vegan myself, I have no idea what Piers Morgan has done today to trigger a row about vegan sausage rolls. This is what I get whenever anyone tweets him... \nI heartily recommend getting blocked by the man - makes Twitter a far more enjoyable experience! https://t.co/WNEFsby27C",17536829,2008-11-21T14:18:47.000Z,EtanSmallman,All good newsagents / London ,4456,"London, England",0,0,0.3989
1294,1080858949488922626,2019-01-03 16:10:29+00:00,We're so glad you love our elderflower &amp; our caddies. Enjoy! ☕\n\n#detox #herbal #tea #sustainable #NewHorizons #newyear #teapro #tisane #infusion #natural #wellness #fitness #healthy #health #healthylifestyle #luxury #lifestyle #chef #foodie #glutenfree #vegan #vegetarian #london https://t.co/5irhU3YQy4,791408393961570304,2016-10-26T22:37:19.000Z,NazaniTea,"London, England",934,Selfridges,2,2,0.9052
1295,1080858846292312066,2019-01-03 16:10:04+00:00,"We're back and open for 2019!\n\nAnd with the kitchen open from 5.30pm you can come and treat yourself to our vegan-first small plates menu.\n\nAs well as our usual fare we also have mocktails, soft and hot drinks too for those taking a break from the excess of the holiday season. https://t.co/35nMSyyX72",1027198371818348544,2018-08-08T14:22:31.000Z,TheAppleTreeLDN,"London, England",892,Apple Tree,1,1,0.7777
1297,1080857159695560705,2019-01-03 16:03:22+00:00,Chesterfield devastated by vegan sausage roll crisis https://t.co/TqMJchO3WX,1734766740,2013-09-06T11:13:45.000Z,MeadowcroftRob,London,2078,"Camberwell, London",0,0,-0.8442
1298,1080853305499230209,2019-01-03 15:48:03+00:00,"Hey meat eaters, where do you get your protein from? #Vegan \n\n#CouldntHelpMyself https://t.co/SD5k6RfMDd",2568713096,2014-06-15T09:33:43.000Z,_JenniferJayne,"London, UK",757,"Camden Town, London",0,0,0.0
1299,1080851483996966912,2019-01-03 15:40:49+00:00,I'm not vegan but it's logical to be one. People being compassionate is clearly something you cannot relate with. 🤦🏾‍♂️ https://t.co/AP001mkyRg,20703347,2009-02-12T18:53:03.000Z,Ryan_Colaco,"London, England, UK",3437,"London, England",0,1,0.8338
1300,1080851458931728384,2019-01-03 15:40:43+00:00,"The simple fact, a vegan sausage roll is the top trend on my Twitter feed, gives me hope for 2019 #greggsvegansausageroll",21360473,2009-02-20T01:10:59.000Z,danthesoundman,UK / Hammersmith end,1734,"London, England",4,0,0.5719
1302,1080848753794449409,2019-01-03 15:29:58+00:00,I’m not a vegan but I bet the reason my town isn’t on here is because John Redwood is the local MP and full of stuck up tories https://t.co/9xmRcBXcBi,110150563,2010-01-31T14:34:04.000Z,_sphh,"Wokingham, England",773,"Camden Town, London",3,0,-0.3612
1303,1080846028608360448,2019-01-03 15:19:09+00:00,"If You Are Gonna Be A Vegan, Be A Vegan In Peace Because These Are My Current Feels 🍗🍝🍤😋 @ London, United Kingdom https://t.co/JjWIUeymgv",90062494,2009-11-15T01:09:43.000Z,JuniorCxrtier,Ice City ❄️🏙,1375,"London, England",1,0,0.743
1305,1080845203592937474,2019-01-03 15:15:52+00:00,💖 Sending lots of teaful wishes! 💖\n\n#christmas #christmasgifts #gift #gifts #giftideas #lux #tisane #infusion #natural #wellness #fitness #healthy #health #healthylifestyle #luxury #lifestyle #pure #chef #foodie #tea #glutenfree #herbal #tisane #detox #vegan #vegetarian #london https://t.co/ZVqEe6bhFW,791408393961570304,2016-10-26T22:37:19.000Z,NazaniTea,"London, England",934,"Paddington, London",1,1,0.2244
1307,1080841007355314182,2019-01-03 14:59:11+00:00,Why does it bother people that a shop’s menu has gotten larger? It’s not like they replaced regular sausage rolls??? No one is forcing you to eat the vegan sausage roll??? What are you resisting??? Other people’s choice??? https://t.co/C60gQVhIRi,22640188,2009-03-03T16:17:57.000Z,iamanthonyjames,"Stratford, London",3045,"City of London, London",12,0,-0.7697
1308,1080839332188114944,2019-01-03 14:52:32+00:00,"Been sent the new Four Cheese vegan pizza from @WeAreZizzi to try. Looks like real cheese, smells like real cheese... 🤞 https://t.co/SAYiuueU3f",607637895,2012-06-13T21:13:25.000Z,xanthaleatham,"London, England",601,"Kensington, London",3,0,0.6124
1309,1080836521853444098,2019-01-03 14:41:22+00:00,"So Piers M's vegan sausage roll meltdown yesterday was more fake news, was it, seeing as Greggs' PR agency also pimped his book and all?",88397713,2009-11-08T11:04:43.000Z,bobgranleese,,5838,"Islington, London",13,1,-0.5256
1310,1080835057563168768,2019-01-03 14:35:33+00:00,The vegan sausage roll from Greggs is surprisingly good. I wonder if @piersmorgan might be persuaded to give it a go https://t.co/ghlbrtvawn https://t.co/Ljadq65vWm,31128890,2009-04-14T14:08:25.000Z,Richardvines,City of London.,43201,"City of London, London",12,2,0.6249
1311,1080834054998671361,2019-01-03 14:31:34+00:00,The Berry Sparkle has an intriguing undernote of #kombucha !\n\nwildfoodcafe_islington #vegetarian #vegan #whole #raw #natural #food #vegandiet\n@wildfoodcafe #islington #upperstreet… https://t.co/t6N6orrlXr,487906187,2012-02-09T21:34:54.000Z,goantolondon,London,2514,"Islington, London",2,0,0.4753
1312,1080829959483084802,2019-01-03 14:15:17+00:00,Loving the crisp bases of their #veganpizzas (a rarity we have found with vegan versions ) - delicious #Pepperoni and Creamy Wild Mushroom! \n\nwildfoodcafe_islington #vegetarian #vegan… https://t.co/XqElIr8hN2,487906187,2012-02-09T21:34:54.000Z,goantolondon,London,2514,"Islington, London",1,2,0.8356
1313,1080828607717621760,2019-01-03 14:09:55+00:00,I’ve unintentionally eaten completely vegan today and it’s been way easier than I expected 🌱,2786901137,2014-09-27T09:01:12.000Z,Aliceliveing_,United Kingdom,50505,"Kensington, London",119,0,0.4215
1314,1080827196812509184,2019-01-03 14:04:19+00:00,Happy new year!  We’ll be open again next Thursday 10  and Friday 11 January  with healthy vegetarian and vegan cooking and farm fresh winter salads 🌱looking forward to seeing you!… https://t.co/jMlMkGzn8O,2867002667,2014-11-08T07:41:40.000Z,LoughFarm,Loughborough Road,1926,"Lambeth, London",6,3,0.8513
1315,1080826366487076865,2019-01-03 14:01:01+00:00,"Come as us 2019! We’re ready for you. New Buddha bowl on the menu with fresh crunchy veggies, pickled cabbage, quinoa, pomegranate, and tahini dressing 🤤. #vegan #buddhabowl #salad… https://t.co/ErlOnPd8ur",3054059525,2015-02-22T22:00:41.000Z,CAYABrixton,"Brixton, England",351,"Lambeth, London",2,1,0.6239
1316,1080824601414979584,2019-01-03 13:54:00+00:00,"Divine Pine smoothie with Teriyaki Almonds, a great combination to start  ..  &amp; smoothie surprise at bottom of an actual pine needle!  \n\nwildfoodcafe_islington #vegetarian #vegan #whole… https://t.co/vy8FIUuMIB",487906187,2012-02-09T21:34:54.000Z,goantolondon,London,2514,"Islington, London",0,0,0.8777
1317,1080823706396569607,2019-01-03 13:50:26+00:00,"@BillyHuyton3 @hipsterhaymitch I still eat meat but would consider stopping if I could get affordable easy accessible alternatives, the vegan sausage roll is just a step in the right direction",2694803055,2014-07-10T11:23:50.000Z,jamestroe,"London, England",1387,"London, England",1,0,0.4497
1318,1080821922034798594,2019-01-03 13:43:21+00:00,Might become vegan just to piss off piers morgan x,235300055,2011-01-07T21:07:50.000Z,joshualawlor,London,359,"London, England",0,0,-0.4019
1320,1080821333628538881,2019-01-03 13:41:01+00:00,This vegan sausage roll from @GreggsOfficial is bloody excellent though. Hot out of the oven and only a quid.\n\n(I appreciate it's not exactly a health food...) https://t.co/yTNV4v6WNw,2960864807,2015-01-04T20:27:02.000Z,beerinthesuburb,North London,717,"Islington, London",3,1,0.5423
1322,1080820805787967488,2019-01-03 13:38:55+00:00,@OconnorPaul46 The thing about being a vegan is you get to get a lot of practice reading labels. We get to quickly learn what's actually in food.,47364800,2009-06-15T15:46:39.000Z,BishopWeston,London & New Forest,6848,"Camden Town, London",3,0,0.0
1323,1080820735214538752,2019-01-03 13:38:38+00:00,Got the penultimate one and pretty happy with it tbh #greggsvegansausageroll #greggs #vegan @GreggsOfficial https://t.co/RG4cdBWEh3,295591101,2011-05-09T09:51:50.000Z,LondonNIrish,"Tooting Bec, London",389,Bank Underground Station,2,0,0.7845
1325,1080818941956710400,2019-01-03 13:31:31+00:00,@nolkeD I’d definitely consider going full vegan if i was able to get a hold of all the alternatives,2694803055,2014-07-10T11:23:50.000Z,jamestroe,"London, England",1387,"London, England",0,0,0.4019
1327,1080818631406219264,2019-01-03 13:30:17+00:00,"@HanBanBakery @GreggsOfficial @piersmorgan Indeed, most vegan sausages have more protein than ordinary pig or cow sausages",47364800,2009-06-15T15:46:39.000Z,BishopWeston,London & New Forest,6848,"Camden Town, London",3,0,0.0
1328,1080818100931563520,2019-01-03 13:28:10+00:00,Looking forward to @susannareid100 force feeding @piersmorgan a @GreggsOfficial vegan sausage roll at some point in the not too distant future #GMB,20769278,2009-02-13T13:22:03.000Z,Speedqueenie,London - Leeds - The World ,2655,"Camden Town, London",0,0,0.0
1329,1080816755021365249,2019-01-03 13:22:49+00:00,No one is making anyone eat the Fucking vegan sausage roll.,19778490,2009-01-30T17:48:56.000Z,RachaelParkman,London,993,"Paddington, London",3,1,-0.296
1330,1080814063607795712,2019-01-03 13:12:07+00:00,A year ago I did #veganuary and have been 95% plant based ever since. IF you fancy learning more I would check out @zannavandijk and her approach to veganism. It’s makes it less overwhelming and more approachable https://t.co/p8Q9Pg5Bq5,46771787,2009-06-12T23:06:20.000Z,Bamblingsofnafy,Stars Hallow,2333,"London, England",3,0,0.0
1331,1080811569980862464,2019-01-03 13:02:13+00:00,Just let you know- those vegan sausage rolls are actually banging.,210923640,2010-11-01T20:10:59.000Z,qmconor,,576,"London, England",2,0,0.0
1332,1080810859226632192,2019-01-03 12:59:23+00:00,"The Greggs near my office has sold out of the vegan sausage roll. Damn your smart PR campaign, Greggs! https://t.co/EwixT4e1I8",20393957,2009-02-08T21:24:22.000Z,drewalmighty,"iPhone: 0.000000,0.000000",394,"Camden Town, London",0,0,0.0
1334,1080809904812814337,2019-01-03 12:55:36+00:00,Paid. 8 min wait for vegan sausage roll. Literally another queue for the trendy Greggs goers who’ve already paid. See other pic (left side). \n\nChaos.,176933556,2010-08-10T20:43:22.000Z,davymace,"Winchmore Hill, London",348,"Camden Town, London",1,0,0.0
1335,1080809205630730240,2019-01-03 12:52:49+00:00,All the Greggs near my office have no vegan sausage rolls and I am SAD,218264737,2010-11-21T21:42:39.000Z,joannalolrence,SE London,252,"Islington, London",0,0,-0.7213
1336,1080807362573803520,2019-01-03 12:45:30+00:00,@GreggsOfficial is there a Greggs in London (near Farringdon) that has the vegan sausage roll? Been to leather lane- no delivery. Chancery Lane- sold out. Thank you!!,307985418,2011-05-30T16:49:09.000Z,_imogenfex,,199,"Islington, London",0,0,0.2225
1337,1080807282928160768,2019-01-03 12:45:11+00:00,Off to Greggs for my vegan sausage roll.,176933556,2010-08-10T20:43:22.000Z,davymace,"Winchmore Hill, London",348,"Camden Town, London",2,0,0.0
1339,1080800873025077248,2019-01-03 12:19:43+00:00,"@GreggsOfficial as a non vegan , i cant wait to try this",351880086,2011-08-09T21:14:57.000Z,irish_turk,"Hackney, London innit .",281,"City of London, London",48,0,0.0
1340,1080796290995421184,2019-01-03 12:01:30+00:00,Went to get a @GreggsOfficial vegan sausage roll just now and they'd sold out and I'd have had to wait! I blame piers moron! :-( #notevenavegan,86986302,2009-11-02T17:28:15.000Z,drnick_p,"Islington, London",1710,"London, England",2,0,-0.8264
1341,1080794872343343104,2019-01-03 11:55:52+00:00,I might become a vegan just to distance myself further from Piers Morgan.,19494397,2009-01-25T16:47:59.000Z,LongshanksE10,"Bishop's Stortford and London, UK",707,"Paddington, London",8,0,0.0
1342,1080794197752508416,2019-01-03 11:53:11+00:00,My #ThursdayMotivation is knowing that Piers Morgan is having a meltdown over the #VeganSausageRoll - knowing my diet choice upsets him so much makes me happy... #Vegan,2568713096,2014-06-15T09:33:43.000Z,_JenniferJayne,"London, UK",757,"Camden Town, London",0,0,-0.3612
1343,1080793997067644929,2019-01-03 11:52:23+00:00,We're proud to make perfectly pinchable fries! 🍟 \n.\n.\n.\n.\n#veganblogger #londonblogger #risottoballs #arancinibrothers #timeoutlondon #vegan #whatveganseat #arancini #happycow #londonvegan… https://t.co/d8piplLnsN,84396832,2009-10-22T19:03:16.000Z,AranciniBros,"London, United Kingdom",2062,"London, England",1,0,0.8221
1344,1080787168203849728,2019-01-03 11:25:15+00:00,"Will the upward trend of support for radical veganism, socialism, infinite genders and extreme feminism continue in 2019 or will we go full circle?",46004512,2009-06-10T01:39:07.000Z,elnino550,"London, England",273,"Camberwell, London",0,0,0.4019
1345,1080785355698290688,2019-01-03 11:18:03+00:00,I just tried the vegan sausage roll @GreggsOfficial for @tictoc and it's not bad at all https://t.co/wxBZAoWW0Q https://t.co/h6SI3YDrIx,31128890,2009-04-14T14:08:25.000Z,Richardvines,City of London.,43201,"City of London, London",41,2,0.431
1346,1080778884747063298,2019-01-03 10:52:20+00:00,"@AdamCC92 Oh hello. Not heard from you in a while, happy New Year; I can’t say I use them, I have sampled their sausage rolls on occasion, I’m more concerned that the credibility of veganism is gathering too much pace.. proper bakers are lovely, can’t say I have access to any.",53874435,2009-07-05T09:10:59.000Z,louiseallain,Westminster,3248,"London, England",0,0,0.8176
1347,1080776579570171904,2019-01-03 10:43:11+00:00,😎😎😎 Confidence breeds strength! 😎😎😎\n-\n-\n-\n#vegan #selfie #ootd #makeup #face #brows #eyes #lips #hair #gains #workout #fitness #gym #body #jumpsuit #leopardprint  #dance #travel #fashion… https://t.co/CLyjG8ci28,461986405,2012-01-12T12:39:48.000Z,BOBBYSVEGAN,UK,926,"London, England",3,1,0.7777
1349,1080773328393125888,2019-01-03 10:30:15+00:00,"@paulmgathercole Thank you. I had eggs and bacon for breakfast, but I don’t judge people who prefer fruit and nut cereal with almond milk. Some days I eat only vegetarian or vegan food, but I don’t apply those descriptions to myself.",191898033,2010-09-17T17:02:45.000Z,MarkGaze,London ,3001,"Camden Town, London",0,0,0.1901
1350,1080772647145914368,2019-01-03 10:27:33+00:00,https://t.co/MBIljKi2JQ\n#vegan #detox #holidays #vegetarian #NYE #xmas #cooking #chef #healthy #homemade #class #market #brixton #skill #learn #brixtonvillage @… https://t.co/YwhM7Oujrw,198998532,2010-10-05T19:38:38.000Z,CasaSibilla,London,682,"Lambeth, London",0,0,0.0
1351,1080767409361960960,2019-01-03 10:06:44+00:00,I've got no issues with a vegan sausage role. Probably better for you than whatever pork products Greggs use for the meat version...,80812656,2009-10-08T09:55:22.000Z,Philly_Spurr,London,1316,"Paddington, London",0,0,0.1779
1352,1080767019941793793,2019-01-03 10:05:11+00:00,Calling it #thetruthaboutvegans makes it appear like vegans are hiding something and that we all fit in the same circle. There is so much diversity in the vegan community and people we've met are pretty open about everything!,25806097,2009-03-22T11:01:15.000Z,MsCupcakeUK,,11646,"Camberwell, London",10,1,0.7424
1353,1080765595266748416,2019-01-03 09:59:32+00:00,"#fragBR24💡 Was wäre, wenn sich jeder vegan ernähren würde? | https://t.co/6SDJJXxCSs via @BR24",901611684137185284,2017-08-27T01:05:51.000Z,kc_london_diary,"London, England",13,"Islington, London",0,0,0.0
1355,1080762899986071553,2019-01-03 09:48:49+00:00,@johnharris1969 Vegan sausage furore is dull. But there’s something more interesting going on with Gregg’s - it’s become the middle class commentators faux touchstone of imagined working class life.,216293940,2010-11-16T09:07:06.000Z,thedigester,Brixton,152,"City of London, London",5,0,0.0754
1356,1080759039657738240,2019-01-03 09:33:29+00:00,"It's #Veganuary so why not take a closer look at your skincare too? \nMake that switch to natural, vegan, cruelty-free products and enjoy the benefits of beauty that's kinder to your skin… https://t.co/v8yXfPzvx9",2839429882,2014-10-21T07:36:54.000Z,jannatsyed01,,1303,"Camberwell, London",0,0,0.936
1357,1080758607258505216,2019-01-03 09:31:46+00:00,Happy New Year! We’re back and to celebrate a year of being 100% vegan and to continue to support the amazing work of trusselltrust we’ll be offering 2 for 1 on all food throughout… https://t.co/SnnL9go18n,318525063,2011-06-16T16:37:37.000Z,TB_and_TT,"London, EC1V 4PA",789,"Islington, London",10,5,0.9348
1358,1080758285282750465,2019-01-03 09:30:29+00:00,"It's #Veganuary so why not take a closer look at your skincare too? \nMake that switch to natural, vegan, cruelty-free products and enjoy the benefits of beauty that's kinder to your skin… https://t.co/yS7vJX6KFW",2839429882,2014-10-21T07:36:54.000Z,jannatsyed01,,1303,"London, England",1,0,0.936
1359,1080752766186852352,2019-01-03 09:08:33+00:00,"My morning, this morning, living my best vegan life 🌱 #vegansausageroll https://t.co/J8uf8MTh1N",160315969,2010-06-27T21:01:23.000Z,babbit_janeway,Stan’s Used Ship Emporium,988,"Paddington, London",14,0,0.6369
1361,1080746451892875265,2019-01-03 08:43:28+00:00,"@YemSmoothies @veganshirtsuk Or pop over to ours for some delicious HOMEMADE VEGAN BUCKWHEAT, ALMOND MILK &amp; BANANA PANCAKES - topped w/ fruit compote &amp; coconut yoghurt 😋",38034298,2009-05-05T22:09:56.000Z,naturalkitchen,"London, UK",2565,"London, England",1,0,0.5719
1362,1080742383573221376,2019-01-03 08:27:18+00:00,"The internet is having a shit fit over @GreggsOfficial making a vegan sausage roll. \n\nI’m just sat over here going “ah shit, I’m going to have to move up a weight class” 😂 https://t.co/qiszyuxdOT",202800122,2010-10-14T21:13:52.000Z,LenDemetriou,London,1069,"Lambeth, London",1,0,-0.6908
1363,1080739710778163201,2019-01-03 08:16:40+00:00,If you are getting angry at Vegan Sausage Rolls you need to have a good hard look at yourself.,110530587,2010-02-01T21:48:50.000Z,wembleypilgrim,,245,"Lambeth, London",2,1,-0.2023
1364,1080730569816850432,2019-01-03 07:40:21+00:00,"Restoring some balance last night with this super easy, healthy and tasty (I promise) vegan Mexican chilli 🌶🌶🌶\n⠀⠀⠀⠀⠀⠀⠀⠀⠀\nThe full recipe is now saved in my story highlights if you want to… https://t.co/bgcnp6cbM6",2472737582,2014-05-01T16:24:50.000Z,HunHunPanda,,48,"London, England",1,0,0.9385
1365,1080727688694910976,2019-01-03 07:28:54+00:00,What is going on?! Will keep you all updated once I try one.\n#vegansausageroll #Greggs #saussage #vegan https://t.co/QSjA0m1sYj,2899952902,2014-11-30T23:38:44.000Z,nimeshpokar,"Saint Albans, East",78,"London, England",1,0,0.0
1366,1080714615053537280,2019-01-03 06:36:57+00:00,RT RETWEET &amp; FOLLOW for a chance to win one of theses vegan chocolate sauces - winner picked Fri 11 Jan   #WinItWednesday #FreebieFriday #giveaways #prize #win #competitions #competition #CompetitionTime #vegan #chocolate #retweetandfollow #retweet #rt https://t.co/OeNoCyU8AW,103235552,2010-01-09T10:00:16.000Z,KirlySueKitchen,"London, England",10076,"Islington, London",410,796,0.8625
1367,1080707928263397377,2019-01-03 06:10:23+00:00,@piersmorgan Piers what has become interesting is how you've become obsessed with vegans and you manage to keep up the vegan debate going by continuing to obsess about them!,714355818448175105,2016-03-28T07:37:54.000Z,Erosmacvyas,"London, England",77,"Camberwell, London",0,0,0.0
1368,1080706443605626880,2019-01-03 06:04:29+00:00,@piersmorgan Vegan resistance? Who cares?\n\nLet them eat kale.,2793029303,2014-09-29T22:40:20.000Z,Underdogsbiteup,,4801,"City of London, London",2,0,0.0
1369,1080655398837932032,2019-01-03 02:41:39+00:00,"@piersmorgan Piers should not knock vegans, it’s the correct way to live. Dr Dean Ornish MD in USA is saving lives, including that of Bill Clinton. Plant based nutrition reverses heart disease &amp; other degenerative diseases. Dr Ornish’s nutrition program is available through Medicare.",888813848635072512,2017-07-22T17:31:49.000Z,InstantMichaels,"Kensington, London",104,"Kensington, London",0,0,0.0
1371,1080627123549888513,2019-01-03 00:49:17+00:00,"@GizziErskine @ThomHetheringto @GreggsOfficial Fuck sake, vegan sausage rolls predate hipsters et al",407081565,2011-11-07T16:17:29.000Z,arryjudd,,44,"Camden Town, London",0,0,-0.5423
1372,1080626909434822656,2019-01-03 00:48:26+00:00,Much needed and such a great way to end day 2 of 2019 - candlelit yoga!  🤸✨🤸 \nFollowed by me dishing up a light homemade vegan dinner - thank you yogibarefoot_ for joining me this evening… https://t.co/ymhL0PlkMe,3439128868,2015-08-25T12:05:08.000Z,KDeluxeLDN,"London, England",64,"London, England",2,0,0.784
1373,1080624873985191936,2019-01-03 00:40:21+00:00,"“I’ll give you ‘vegan sausage roll’ in a minute! Wait, that came out wrong... where are you going?”",710752053,2013-10-12T11:30:27.000Z,5goalthriller,"Merton, London",1666,"Lambeth, London",0,0,0.0
1374,1080621363101089793,2019-01-03 00:26:24+00:00,What a nasty git he is!\nGreggs hits back at Piers Morgan in row over vegan sausage roll launch https://t.co/CrTjXf229k,38858455,2009-05-09T14:11:10.000Z,eileenvn,london,3150,"Camberwell, London",0,0,-0.5983
1375,1080614724025368578,2019-01-03 00:00:01+00:00,8 course vegan tasting menu at Gauthier 💚 @FHarris10 @GauthierSoho #vegan #tastingmenu #finedining #Soho #London #treatday #newyear 😘 @ Gauthier Soho https://t.co/8O9P5JXQIM,315438249,2011-06-11T21:37:16.000Z,MindingAlice,London,316,"London, England",10,1,0.0
1377,1080608135855988747,2019-01-02 23:33:50+00:00,@Tristan_Palmer Just had a vegan burger at Mac n Wild and feeling like I made the wrong life choice tonight. https://t.co/CAoGpGBpu8,114403588,2010-02-15T08:44:01.000Z,davidfirn,London & Liverpool,1680,"London, England",1,0,-0.0258
1378,1080607868750123014,2019-01-02 23:32:47+00:00,"What I’m trying on Friday, a vegan sausage roll... I’m excited that I can more to eat at Greggs than a cheese and onion pastie !",2363887313,2014-02-24T23:31:26.000Z,Marshall5Sharon,"London, England",6386,"Kensington, London",3,0,0.4003
1379,1080606648702550017,2019-01-02 23:27:56+00:00,Second day of 2019 and I'm seeing all these vegan food is this a sign,326219416,2011-06-29T15:35:51.000Z,willalsagoff,🇸🇬🇲🇾🇬🇧,294,"Islington, London",1,0,0.0
1380,1080593569910378496,2019-01-02 22:35:58+00:00,"Thank you Sadia for the glorious recipe. Your vegan double chocolate cookies are delicious. 🤤😁 @ London, United Kingdom https://t.co/BH0nEXIzoW",581413288,2012-05-16T01:29:02.000Z,TheKazThomas,"London, UK",135,"London, England",2,0,0.9217
1381,1080591654627786752,2019-01-02 22:28:21+00:00,How the fuck is veganism anything to do with being PC you walking tub of margarine https://t.co/xPQt8Og9Sw,163886321,2010-07-07T14:33:06.000Z,LukeCB_,Herts/London,6543,"Islington, London",32,2,-0.5423
1382,1080590039195766784,2019-01-02 22:21:56+00:00,“The world’s biggest purchaser of beef @McDonaldsCorp is watching the plant-based meat market” @FT highlights @FAIRRinitiative as concerns intensify over food producers’ impact on environment @EmikoTerazono https://t.co/NGODiuahsh #plantbased #vegan,2327264275,2014-02-04T15:04:13.000Z,Rosie_Wardle,"London, England",1160,"Paddington, London",41,18,0.0
1383,1080584455922696193,2019-01-02 21:59:45+00:00,I’m loving the fact that Pi*rs M*rgan is playing such a significant role in ensuring the success of the Greggs vegan sausage roll.,48429657,2009-06-18T17:53:01.000Z,lepus_octavian,"London, England",2934,"Lambeth, London",12,2,0.9062
1384,1080581340834267136,2019-01-02 21:47:22+00:00,#365ACTNOW  2019 Will Be Year Of The Vegan' According to The Economist https://t.co/WDCnFUAaNx @EAT_Foundation_ @G_stordalen @JKuylenstierna @LondonVegan @Vegantrends @miljotweets @EURACTIV @TheVeganSociety @vegan @tveitdal @ClimateSusanne @OlumideIDOWU @UrbanGateway @FoodNetwork,35538459,2009-04-26T19:14:47.000Z,KajEmbren,"London, United Kingdom",77535,"Camberwell, London",3,4,0.0
1385,1080577824145240064,2019-01-02 21:33:24+00:00,I did an  interview for @thevoicenewspaper about veganism and new year goals #veganism #vegan https://t.co/JP3eskbb30,103235552,2010-01-09T10:00:16.000Z,KirlySueKitchen,"London, England",10076,"Islington, London",4,6,0.0
