index,id,created_at,text,author.id,author.created_at,author.username,author.location,author.public_metrics.followers_count,geo.full_name,public_metrics.like_count,public_metrics.retweet_count,sentiment
2795,1084093504043798528,2019-01-12 14:23:27+00:00,"Look Stylish!\nCruelty-Free ,Vegan 🌱 Perfect Backpack 🎒 to carry around everything you could need for a little day trip to an amusement park or the city.\nPlease find below link\n\nhttps://t.co/i4yBXL3Vsk\n\n#peta #petauk #vegan #crueltyfree #lookinggood #peaceofmind #veganbackpack https://t.co/K15jyLRFCa",976419994992107520,2018-03-21T11:27:22.000Z,Lifestyleintuk,United Kingdom,119,"Romford, London",0,1,0.7574
2799,1084084871570620416,2019-01-12 13:49:09+00:00,@GavCalver I am glad that my vegan mate doesn't have to starve when he comes with us to Gregg's. \nI'm certain she's not heading in there looking for healthy food!,27151453,2009-03-28T01:43:36.000Z,Windy_London,London,7904,"Kingston upon Thames, London",1,0,0.859
2800,1084084269763444737,2019-01-12 13:46:45+00:00,This has to be the only reason I’d date a Vegan girl https://t.co/xvLjhtJHKn,834449019577450497,2017-02-22T17:05:24.000Z,_EmzEdits,,480,"Hackney, London",0,0,0.0
2801,1084082993516462080,2019-01-12 13:41:41+00:00,it me eating a vegan sausage roll looking dead pleased with myself https://t.co/tFzkdDSl7A,132463047,2010-04-13T09:09:09.000Z,mademoiselleegg,"Hackney, London",472,"Hackney, London",2,1,-0.34
2803,1084081521416437760,2019-01-12 13:35:50+00:00,"@ChrisGPackham @frogprincess8 Here's a graphic of the 'sanity' of making choices that actually make the most difference to the lungs of the world. Celibacy far more effective than Veganism. Are people prepared to forgo children, holidays, heating their homes, all of which have more impact? https://t.co/byoKj6lyEF",20613575,2009-02-11T19:11:59.000Z,Tom_Clarke,North London & The Fens,5860,"Hammersmith, London",11,2,0.7841
2807,1084069918964940801,2019-01-12 12:49:44+00:00,"On Sundays we serve our brunch menu 11-4. We got pancakes, waffles, vegan fry ups and more..                              ————————————————————#TheFullNelsonDeptford #fullnelson #bar… https://t.co/L9NlcCMzvQ",776455463256850436,2016-09-15T16:19:43.000Z,FullNelsonSE8,"London, England",588,"Lewisham, London",0,0,0.0
2810,1084066641166716928,2019-01-12 12:36:42+00:00,"Looking for a one stop shop for all those vegan goodies? Try @VeganTown..if you're still not sure, read all about them in our close up piece...https://t.co/caMyQqQ21U #SaturdayShopping #TreatTime",338283549,2011-07-19T10:34:15.000Z,goupiegroupies,Tunbridge Wells,3412,"Greenwich, London",0,0,-0.4874
2812,1084063732655886336,2019-01-12 12:25:09+00:00,(I had the vegan chipotle guac burger and it was excellent. Makes #Veganuary easy 👍),2960864807,2015-01-04T20:27:02.000Z,beerinthesuburb,North London,717,"Enfield, London",3,2,0.765
2814,1084051097197658112,2019-01-12 11:34:56+00:00,"Fair play @GreggsOfficial , the vegan sausage roll is tasty",1089606066,2013-01-14T17:19:58.000Z,jackaarondavies,"London, England",198,"Merton, London",1,0,0.5719
2816,1084040829285683200,2019-01-12 10:54:08+00:00,He must have took another bite out of that vegan sausage roll the poor sod x https://t.co/gVdDIDUX5J,139369744,2010-05-02T11:39:33.000Z,coxy__jack,West London,1027,"Harrow, London",1,1,-0.4767
2819,1084023203813621761,2019-01-12 09:44:06+00:00,@PETAUK @RachelRileyRR You’re vegan too Rachel? I think I want to be bffs :),414825929,2011-11-17T14:51:51.000Z,ES_Entrepreneur,"Cali, London or in the ☁️ ",22050,"Brent, London",0,0,0.5106
2825,1084006232720097280,2019-01-12 08:36:40+00:00,"Live now in @RomanRoadLDN . Sourdough, artisan pastries, Vegan chocolate, sugar-free dreams. #run #yoga #tour https://t.co/qrAowFwKh0",934892821,2012-11-08T16:30:51.000Z,St_SugarLondon,"London, England",2150,"Poplar, London",1,1,0.4019
2826,1084002149317599232,2019-01-12 08:20:26+00:00,Our sweetcorn &amp; courgette fritters. On the menu all weekend. So good as they are for a tasty AF VEGAN &amp; GF Brunch. Or add eggs and bacon if you're into that. 👌\n\n#walthamstow #e17… https://t.co/lhPqSeIF9i,1423669243,2013-05-12T17:42:54.000Z,woodstcoffee,E17 Walthamstow,3501,"Walthamstow, London",0,0,0.4927
2830,1083991497089916929,2019-01-12 07:38:07+00:00,Goooooood mooooorning 😍 and welcome to the weekend 🎉 #veganuary #breakfast #artisan #vegan #plantbased https://t.co/RhHWQwHTFE,70640678,2009-09-01T09:31:55.000Z,CoughlansBakery,South London & Surrey,2153,"Croydon, London",8,2,0.4588
2831,1083986012248915968,2019-01-12 07:16:19+00:00,"Beige food is TASTY, it is honestly!! I made a determination at the start of the year to cook more and then ALL the world came out with their plant-based food and I want to try it all.… https://t.co/acGorxTeJo",16981246,2008-10-26T15:09:41.000Z,linsdrabwell,"London, UK",6085,"Lewisham, London",0,0,0.7639
2835,1083878348286251008,2019-01-12 00:08:30+00:00,(vegan fake duck from the local Chinese),30379063,2009-04-11T02:48:32.000Z,nialltg,"London, England",3298,"Stratford, London",2,0,-0.4767
2840,1083852327008776193,2019-01-11 22:25:06+00:00,@jamieoliver I’m trying the lasagne from last week (but with non vegan cheese-sorry) I’m a huge meat lover but fancy trying something new! Thanks for the inspo! 🙂,255143172,2011-02-20T19:27:00.000Z,zarascakes,From Stockport to London,282,"Croydon, London",0,0,0.8168
2842,1083844087361474560,2019-01-11 21:52:21+00:00,Does he actually think being vegan is a health fad???? Come and see my freezer full of vegan nuggets piersy boy. We aren’t vegan to be skinny. We’re vegan to get big and strong so that we can crush the skulls of our enemies with our thighs. https://t.co/obrHoWDzMq,333716114,2011-07-11T23:50:54.000Z,gothtropical,"London, England",168,"Tottenham, London",2,0,-0.3527
2848,1083834073628450816,2019-01-11 21:12:34+00:00,Free vegan junk food @ionarobinson @VeganOlive1 @VeggievisionTV @VeganBlogger78 @OneBillion_co https://t.co/gbCwTll4gn,361469282,2011-08-24T20:47:56.000Z,robbo_1962,Dumbarton Scotland from London,1374,"Ilford, London",7,1,0.5106
2853,1083825838049550338,2019-01-11 20:39:50+00:00,"This month marks a whole year of me being a vegetarian, after doing vegan January last year; I’ve really felt the benefit and haven’t looked back ✌🏻 So pleased to see restaurants like… https://t.co/UNsmifLh0m",44168761,2009-06-02T18:01:22.000Z,AAUBlog,"London / Surrey, UK",6639,"Sutton, London",1,0,0.7548
2856,1083818755023605761,2019-01-11 20:11:42+00:00,"#vegantip #11: I know this isn’t very helpful for #veganuary, but sometimes it’s better to ease into it rather than going cold turkey. It took me a month to transition from vegetarianism to veganism and I had been veggie for 5 years",175272294,2010-08-06T04:12:07.000Z,meggruthie,"London, England",510,"Poplar, London",1,0,0.846
2858,1083813610449764357,2019-01-11 19:51:15+00:00,I read today that Bruce Springsteen has gone vegan.  Quorn in the USA? God I'm tired.,95217106,2009-12-07T15:08:38.000Z,gazeeebo64,"Barnet, London",2145,"Barnet, London",44,2,-0.2023
2862,1083806064133505025,2019-01-11 19:21:16+00:00,"@leuconeura_ @SamNichol_98 Yas. Sacla do a vegetarian basil pesto which is Pretty good, uses another Italian hard cheese, they also do a vegan one but it’s not as good 😬",18305161,2008-12-22T11:12:01.000Z,imy,"City of London, London",23556,"Poplar, London",1,0,0.7717
2864,1083797602074800128,2019-01-11 18:47:38+00:00,"Let's see if all this fits on my stomach 🤔 Lettuce, avocado, blueberries, dates, grapes, pears, carrots and sauerkraut. #organic #vegan #raw #veganuary https://t.co/Y8WeniXmPI",35478057,2009-04-26T14:44:43.000Z,ravisandhu8,London,1178,"Hillingdon, London",3,0,0.0
2866,1083794366152523782,2019-01-11 18:34:47+00:00,Vegan heaven.  @piersmorgan https://t.co/kI6s68z5jd,43963113,2009-06-01T20:21:18.000Z,JLM_cork,"Cork, Ireland",2360,"Croydon, London",4,0,0.5106
2867,1083789359621509120,2019-01-11 18:14:53+00:00,"""Lazy day Christmas cake squares gf vegan"" in #Croydon #UnitedKingdom https://t.co/5TCE6Q6vNc #foodwaste #free",824637752574488576,2017-01-26T15:18:56.000Z,WhatsOnOLIO,,1091,"Croydon, London",0,0,-0.3612
2876,1083761521006649344,2019-01-11 16:24:16+00:00,@naomiaustin @TommyOl_ @GreggsOfficial I mostly eat red meat and there is a direct correlation between red meat consumption and bowel cancer risk. More convenience vegan options (and thus also non-dairy) make it much easier for me to eat “healthier” foods when I choose to 🤷‍♀️,18305161,2008-12-22T11:12:01.000Z,imy,"City of London, London",23556,"Poplar, London",1,0,-0.5719
2878,1083760774743498757,2019-01-11 16:21:18+00:00,@AMGarvey But you're embracing veganism😀😀😀,223493381,2010-12-06T15:05:45.000Z,BurmaBear,"London, England.",310,"Poplar, London",1,0,0.0
2879,1083759803044974593,2019-01-11 16:17:26+00:00,Healthy snacks the ‘hot’ vegan way🌶 #Veganuary2019 https://t.co/tBqQ0KTSzn,771681458,2012-08-21T15:10:02.000Z,estelleyoga,Hammersmith/Brookgreen London,646,"Hammersmith, London",0,0,0.4019
2882,1083755482601394182,2019-01-11 16:00:16+00:00,"@naomiaustin @TommyOl_ @GreggsOfficial Noooo I’m very much an omnivore but I do like to keep my bowel cancer risk down by eating more vegan when I can, and I try to avoid dairy because it makes me feel sickly, so as a meat eater, MORE VEGAN PLEASE.",18305161,2008-12-22T11:12:01.000Z,imy,"City of London, London",23556,"Poplar, London",7,0,-0.4192
2885,1083753919354994688,2019-01-11 15:54:04+00:00,Amazing vegan lunch from eatwithtommathews #mumsthatlunch #tooting #vegan #january #friday @ Unwined in Tooting https://t.co/6kEA8nnvG3,23988845,2009-03-12T17:32:45.000Z,CarolineBrennan,".Tooting, London",1025,"Wandsworth, London",0,1,0.5859
2886,1083751232550961152,2019-01-11 15:43:23+00:00,"Whether you’re doing the full #veganuary, or you’re just looking for a quick and easy vegan dinner, you’re in for a treat 👌\n👩🏻‍🍳The innovative new vegan cauliflower, chickpea and potato… https://t.co/eZRRIoUfsl",459622921,2012-01-09T21:43:22.000Z,mintandrosemary,London,509,"Ealing, London",0,0,0.8176
2888,1083730256685662208,2019-01-11 14:20:02+00:00,Veg stock for Sunday roast #vegpower #vegpoweruk #vegan #sundayroast matthancockmp @ The Plumstead Pantry https://t.co/ZLXdzOPZMz,3152893199,2015-04-09T22:21:29.000Z,PlumPantry,Plumstead in borough of Greenw,2059,"Eltham, London",2,0,0.0
2892,1083726020660875266,2019-01-11 14:03:12+00:00,I've tried to be vegan but it's too haaaard,133929621,2010-04-17T01:12:26.000Z,Dhayblooming,Santo Domingo,617,"Tottenham, London",0,0,0.0
2894,1083723593811456000,2019-01-11 13:53:34+00:00,vegan sweet food treats are way nicer than ordinary ones ngl,1307697036,2013-03-27T14:57:30.000Z,AnnabelleHall99,Hertfordshire,491,"Richmond, London",0,0,0.7096
2895,1083722945300742149,2019-01-11 13:50:59+00:00,And for all those doing #Veganuary @waitrose in #Kingston has you covered...\n\nSave 1/3 on @PizzaExpress #vegan giardiniera 🍕🌱 https://t.co/jXzk0VXg5k,1057383306210217984,2018-10-30T21:26:40.000Z,TweetsByVikki,"Kingston upon Thames, London",239,"Kingston upon Thames, London",0,0,0.0
2898,1083716411070054400,2019-01-11 13:25:01+00:00,@piersmorgan Being his usual dumb self.  I am not even vegan and I know that being vegan is not purely about a health choice... https://t.co/y678cpQ3YB,14880790,2008-05-23T12:27:21.000Z,el_enano,"London, England",441,"Poplar, London",0,0,-0.5106
2907,1083694019648069632,2019-01-11 11:56:03+00:00,@BoyGeorge You just need my homemade vegan parmesan sprinkled on that now to finish it off perfectly. I’ll send you some over,492565295,2012-02-14T21:30:08.000Z,The1980sGirl,the 80s ,13185,"Wandsworth, London",2,0,0.6369
2910,1083693227159502848,2019-01-11 11:52:54+00:00,#vegan https://t.co/cZltgUUxTf,35488014,2009-04-26T15:33:04.000Z,julianholder,Britain,1686,"Brent, London",0,0,0.0
2911,1083690933688958977,2019-01-11 11:43:47+00:00,Looking forward to lunch with @ThinkBusiness today! #Vegan eating! https://t.co/vJAn0IL4ED,20319821,2009-02-07T17:04:37.000Z,ZeeshanMallick,"London, England",18446,"Hammersmith, London",1,0,0.0
2912,1083690120354693120,2019-01-11 11:40:33+00:00,Day 9. Attempt 5. Still no vegan sausage rolls in Harrow @GreggsOfficial - rations running low. Might eat own leg.,20860707,2009-02-14T17:54:30.000Z,dan_egg,"London, England",1971,"Harrow, London",2,0,-0.5106
2918,1083676448479682560,2019-01-11 10:46:13+00:00,@Maple_Crunch_8 Hi Kylie - thanks for getting in touch! We have a Vegan Menu all year round and are currently developing some more options :) Thanks!,338240910,2011-07-19T08:36:43.000Z,ASKItalian,UK,13670,"Barnet, London",2,0,0.8728
2921,1083669987385098240,2019-01-11 10:20:33+00:00,It’s Friday folks !!! Get down and treat yourself to our vegan yumminess 😍💚🌱 #vegan #veganuary #plantbased #vegandonuts #vegandanishpastries https://t.co/pCrr7yMIFv,70640678,2009-09-01T09:31:55.000Z,CoughlansBakery,South London & Surrey,2153,"Croydon, London",5,3,0.5538
2922,1083668955967954946,2019-01-11 10:16:27+00:00,This week Vegan Sunday roast is this beautiful Castelfranco. @VeryGreenGrocer #vegpower #vegpoweruk @ The Plumstead Pantry https://t.co/xcxx0AiKJb,3152893199,2015-04-09T22:21:29.000Z,PlumPantry,Plumstead in borough of Greenw,2059,"Eltham, London",3,2,0.6833
2925,1083651014719389696,2019-01-11 09:05:09+00:00,This looks really good. I’m going to try and make this at the weekend #vegansteak #vegan #veganfood #veganlife #veganlondon #gayvegan https://t.co/AY4b4ymdR3,960930860227809281,2018-02-06T17:39:05.000Z,thegingervegan1,"London, England",770,"Hackney, London",1,0,0.4927
2930,1083643130992381952,2019-01-11 08:33:50+00:00,"@sainsburys But if you are vegan/vegetarian, surely you don’t want it to look like the real thing?!",2870994837,2014-11-10T19:16:02.000Z,TouchwoodJo,Kent,873,"Bromley, London",0,0,0.7177
2931,1083632991178579968,2019-01-11 07:53:32+00:00,"It's Friday! You've made it! Treat yo'self....grab a @borough22 donut. They're gluten free and vegan, so are practically good for you! 🍩💚🌿\n.\n#glutenfree #vegan #donut #doughnuts #nudeespresso #zigzagtea #hygge #cafe #se23 #se4 #honoroak #brockley #croftonpark https://t.co/6qiqsZYDoK",1044918967939272709,2018-09-26T11:57:50.000Z,Rise_cafe,"108 Brockley Rise, SE23 1NH",676,"Lewisham, London",1,3,0.8762
2934,1083622003171573760,2019-01-11 07:09:52+00:00,Hey @GMB for the lovely wrestlers who say they are vegan. I wonder if the belt they hope to win is vegan? Would they refuse it if it is leather? Or is it that they eat a vegan diet rather than being vegan! 🤼‍♀️🌱,796421584118542336,2016-11-09T18:37:57.000Z,MichelleAkerman,"London, England",156,"Harefield, London",0,0,0.8736
2935,1083613422674210816,2019-01-11 06:35:47+00:00,https://t.co/bpyiyP23sN,913162334918586368,2017-09-27T22:04:01.000Z,AnitaDarnell8,,1593,"Ilford, London",0,0,0.0
2936,1083527325256302594,2019-01-11 00:53:39+00:00,as a #sephora #beautyinsider I got this #vegan #deluxesample #katevond box for #free.  Contains a #tattooliner  #lockitsettingpowder and #studdedkiss #lipstick #samples.  Thank you!… https://t.co/Na87hiHwGz,25582254,2009-03-20T21:43:04.000Z,Cherri_Lollipop,"London, Ontario",83,"London, Ontario",0,0,0.4199
2937,1083522126387113984,2019-01-11 00:33:00+00:00,"This right here is our little vegan delight....our seeded wholemeal artisan bagel is delicately made with amazing fresh ingredients! We start off with a layer of hummus, a splash of leafy… https://t.co/q9NgIp8u9z",911488102191058944,2017-09-23T07:11:13.000Z,Msplace787,"London,UK",71,"Barnet, London",2,0,0.8122
2938,1083516973101780993,2019-01-11 00:12:31+00:00,"It’s a sausage roll, no vegan is eating this as a healthy food https://t.co/NFvIWyAjFw",1621562390,2013-07-25T23:50:45.000Z,jamiesiddle_,London,4768,"Wandsworth, London",2,0,0.128
2939,1083505684262604805,2019-01-10 23:27:40+00:00,"#vegantip #10: there’s more than one vegan diet. Raw till 4, fully raw, high carb, etc. Shop around and see what works for you! If you don’t like  any rules and want to eat whatever you fancy, that’s fine too! #Veganuary",175272294,2010-08-06T04:12:07.000Z,meggruthie,"London, England",510,"Poplar, London",0,0,0.6351
2943,1083488135613476866,2019-01-10 22:17:56+00:00,@PaulLenarduzzi @EmilyKhan11 What’s in the final 1%? I hope it’s vegan.,339941459,2011-07-21T22:18:53.000Z,RobMcCargow,Born @ 333.13ppm 🌍,17829,"Wandsworth, London",1,0,0.4404
2944,1083484245484556293,2019-01-10 22:02:28+00:00,#veganuary #vegan \nScrambled tofu is yummy 🤤 https://t.co/vdRLnqWMh5,238225604,2011-01-14T17:23:25.000Z,iamgiacomelli,"Hackney, London",283,"Hackney, London",1,0,0.5267
2946,1083478963652083717,2019-01-10 21:41:29+00:00,"@ChrisGPackham @WickedHealthy @ButeIslandFoods @WeAreVeganuary I had a Greggs vegan sausage roll today. Very nice, not much different to the meat one taste wise but healthier. I'm sold. @GreggsOfficial",1652830652,2013-08-07T12:27:12.000Z,Blowmonkey1,"East London, UKe jde",568,"Romford, London",7,0,0.476
2947,1083478812208308224,2019-01-10 21:40:53+00:00,"""2 x portions of White rice - vegan friendly!!!"" in #London #UnitedKingdom https://t.co/dW8SWz12tc #foodwaste #free",824637752574488576,2017-01-26T15:18:56.000Z,WhatsOnOLIO,,1091,"Brent, London",0,0,0.0
2948,1083478473962852352,2019-01-10 21:39:32+00:00,We got the memo tasteatbr7 #tasteatbr7 #vegan #veganfood #veganuary #veganwrap #veganwrapideas #livingwell #eathealthy #eatclean #eatwell #royalparadechislehurst royalparadechislehurst… https://t.co/Y5YLKwydlA,307807600,2011-05-30T09:56:28.000Z,SophiePWood,London / Bodrum,190,"Bromley, London",1,0,0.0
2950,1083478284388761600,2019-01-10 21:38:47+00:00,@DairyEstrogen @coolvegandad95 @asphodelmoon @piersmorgan I would say it is probably about saving animals but I would say right now the more we speak about vegan the better,771681458,2012-08-21T15:10:02.000Z,estelleyoga,Hammersmith/Brookgreen London,646,"Hammersmith, London",0,0,0.5927
2951,1083477559902433285,2019-01-10 21:35:54+00:00,"My turning-vegetarian meal #3 - Vegan Duck Salad from @billsrestaurant - Score: 4/5 this was surprisingly tasty and very close to duck! This is my first time eating seitan, the gluten-y… https://t.co/0boCvYRwkP",15680106,2008-07-31T20:28:08.000Z,voxie,"New Cross, London UK",1082,"Ealing, London",1,0,0.3595
2954,1083470904036868101,2019-01-10 21:09:28+00:00,@CarolOrganic Hi Carol. I will do an event page on the London Vegan Business Network group soon 😊,2935382325,2014-12-21T15:40:45.000Z,ShabariTropic,"London, UK",351,"Southall, London",1,0,0.0
2956,1083466185654652929,2019-01-10 20:50:43+00:00,@montreal_vegan Never enough ink xo,4885753991,2016-02-07T20:34:07.000Z,Brxdleyxxx,"London, England",444,"Bromley, London",0,0,0.0
2958,1083463269589880833,2019-01-10 20:39:07+00:00,"@conorbrn porridge with 1/2 water 1/2 oat milk, cinnamon, agave syrup, almond butter and vegan choc 🤤",267291283,2011-03-16T17:23:22.000Z,daisyjayneking,London / Leeds,351,"Wandsworth, London",0,0,0.0
2960,1083458033441746944,2019-01-10 20:18:19+00:00,@BirdgirlUK Ok so 80% of meals are vegan.\nNot 80% of each meal.\nI think you deserve a gold 🌟,366472287,2011-09-02T07:18:59.000Z,DickDarwin32,,482,"Wandsworth, London",1,0,0.296
2964,1083443649436938240,2019-01-10 19:21:10+00:00,"Don’t judge me 🤷‍♀️ Daught wanted to come out for Dad’s bday so we’re in her fave local eaterie. Haven’t had dinner here for a year so pleasantly surprised at the vegan options. However, I… https://t.co/d5Q4k10NUj",23337004,2009-03-08T18:31:10.000Z,hevcom,"London, England",1176,"Walthamstow, London",0,0,0.843
2974,1083423733614870535,2019-01-10 18:02:01+00:00,So excited to say that we are fully booked for our first week! BUT - there's still some tables left for the beginning of February. Don't miss out - tag your pal and book now https://t.co/rDEQXVTq61. \n\nThank you to everyone for all of the spicy love so far! 🥰 #vegan #walthamstow,3795910694,2015-10-05T20:48:21.000Z,eatspicebox,"London, England",1567,"Walthamstow, London",4,0,0.8719
2976,1083418691272929285,2019-01-10 17:41:59+00:00,"@abinitio1980 What's even the point of saying it, it's true of all food, not just vegan food, and it's spreading irresponsible myths that processed food/additivites are bad. Poison ivy is natural and unprocessed but it's not on the fucking salad bar...",30379063,2009-04-11T02:48:32.000Z,nialltg,"London, England",3298,"Hackney, London",5,1,-0.4215
2977,1083416558561484800,2019-01-10 17:33:31+00:00,Our kitchens getting creative this #Veganuary with these Vegan Crispy Buffalo Cauliflower Florets with Sesame Seeds and Spring Onions 5.50 #vegan #bromley #publife @ Railway Tavern Bromley https://t.co/qMRDfony7j,2591029776,2014-06-27T08:40:12.000Z,railwaybromley,Bromley,1018,"Bromley, London",0,0,0.4404
2980,1083410617896194048,2019-01-10 17:09:54+00:00,@TheloniousFilth @alexfrombristol @BCTHEGRANDSLAM Veganism and Netflix eh? Must be something in the middle of that ven diagram.,283167989,2011-04-16T18:34:12.000Z,thekuntz69,Tom forever.,446,"Barnet, London",0,0,0.0
2985,1083397307876413445,2019-01-10 16:17:01+00:00,"@Tesco Hi, is your falafel &amp; humous wrap vegan?",3438344962,2015-08-24T18:30:53.000Z,BeverleyMSUK,"London, England",226,"Poplar, London",0,0,0.0
2986,1083384408990638080,2019-01-10 15:25:46+00:00,"#Repost @missliberate\n・・・\nIf you're vegan because you can't bare hurting animals with your purchases, then we THANK YOU on behalf of the animals you save each day! ❤️✨Have you ever… https://t.co/RsgHEoB5ZA",1889706301,2013-09-21T10:08:01.000Z,OliverSims_17,"Enfield, London",146,"Enfield, London",0,0,0.8395
2994,1083364277011038208,2019-01-10 14:05:46+00:00,Black and White oldies of Mum 🎞\n.\n.\n#fikre #fikrekitchen #vegan #veganfood #ethiopianfood #ethiopianveganfood #londonfood #photography #foodporn #foodie #habesha #ethiopia #addisababa #throwbackthursday #wayback #hackney #eastlondonfood #throwback #blackandwhite #oldie #tbt https://t.co/Fc4BjydWb3,1058813856133324800,2018-11-03T20:11:09.000Z,fikrekitchen,"Hackney, London",30,"Hackney, London",1,0,0.0
2996,1083364130025865216,2019-01-10 14:05:11+00:00,At least he’s refusing to ever make a vegan risotto..,23203696,2009-03-07T15:49:04.000Z,whatmollyknew,"London, England",598,"Hammersmith, London",0,0,-0.4019
2999,1083360771621470209,2019-01-10 13:51:50+00:00,Vegetarian kebab ready #se23 #vegetarian #vegan #veganlife #honoroakpark #foresthill #lewisham #croftonpark #brockley #sydenham #beckenham #southlondon #newcross #ladywell https://t.co/MjflzDIX7w,719909988609748992,2016-04-12T15:28:11.000Z,HattushR,"68-70 honor oak park, SE23 1DY",1177,"Lewisham, London",1,2,0.3612
3001,1083360506310782976,2019-01-10 13:50:47+00:00,@SilverSpoonLDN Totally love key and mainly veggie but here's some of my fave spots in Brooklyn https://t.co/H7EVMCcFGv,1606486105,2013-07-19T18:05:38.000Z,Emma_Inks,London,3673,"Hackney, London",1,0,0.7647
3006,1083351384580341763,2019-01-10 13:14:32+00:00,I don't think you quite understand he concept of veganism https://t.co/KOifPKzqxL,377446049,2011-09-21T15:56:00.000Z,M4n1er3d3vo1r,NW London,1186,"Lewisham, London",1,0,0.0
3009,1083337188312600576,2019-01-10 12:18:07+00:00,"Eat your greens soup- peas,spinach,broccoli,kale, watercress,celery all from #greengod @VeryGreenGrocer #vegan #healthy #veganuary @ The Plumstead Pantry https://t.co/1GP5CyzZqh",3152893199,2015-04-09T22:21:29.000Z,PlumPantry,Plumstead in borough of Greenw,2059,"Eltham, London",4,1,0.0
3014,1083327350912233472,2019-01-10 11:39:02+00:00,Yassssss who’s doing #veganuary or is thinking about it? I’ve found 12 yummy snacks that you won’t believe are vegan! Sooooo good! Up next on @WandsworthRadio tune in online https://t.co/mH5lnFwXhW https://t.co/zQwUo0m2Sb,140125432,2010-05-04T17:15:21.000Z,LexieCarducci,London,934,"Wandsworth, London",0,1,0.7835
3021,1083316776765739008,2019-01-10 10:57:01+00:00,@ShafikFM @WalaaQuisay oh Allah help us. now you’ve said it there’s no turning back soon we’ll see fried cardboard on some french vegan cooking book go get your patent before it’s too late,927514300054474752,2017-11-06T12:33:36.000Z,firdevsb16,"Ankara, Turkey",999,"Walthamstow, London",1,0,0.128
3024,1083310558726770694,2019-01-10 10:32:18+00:00,"@DirtyVeganTV FYI, the ingredients list for vegan meringues says granulated sugar, but the recipe says caster sugar!",187255824,2010-09-05T18:25:30.000Z,rbaker74,"Royal Arsenal, Woolwich #bhafc",535,"Poplar, London",0,0,0.2636
3029,1083306276308901888,2019-01-10 10:15:17+00:00,"@ChrisGPackham @Tesco @WickedHealthy @WeAreVeganuary Both my ""kids"" are vegan and we've bought Wicked stuff recently. U r right it is really tasty. We, mum and dad, are going for vegan days, limiting the meat we eat.",1652830652,2013-08-07T12:27:12.000Z,Blowmonkey1,"East London, UKe jde",568,"Romford, London",2,0,-0.5267
3033,1083298228743913473,2019-01-10 09:43:19+00:00,Forget Greggs.... we have the best vegan sausage rolls in London! 💚🌿 https://t.co/2R9zhAQzef,994482410413809664,2018-05-10T07:40:58.000Z,SITE_london,198 HACKNEY ROAD LONDON E2 7Q,176,"Poplar, London",4,0,0.5562
3036,1083294666953576448,2019-01-10 09:29:09+00:00,This is awesome! #vegan #veganuary #veganism #veganwednesdays https://t.co/3e52C0xbSB,775972493626601472,2016-09-14T08:20:34.000Z,BrunchGrind,"London, England",373,"Wandsworth, London",0,0,0.6588
3039,1083287689129013249,2019-01-10 09:01:26+00:00,So @marksandspencer seem to be rocking the #vegan thing in 2019. They’re getting my pennies as a result. Bravo M&amp;S 👏🏻👏🏻👏🏻👏🏻 https://t.co/NXsE6zaxhY,960930860227809281,2018-02-06T17:39:05.000Z,thegingervegan1,"London, England",770,"Hackney, London",0,0,0.0
